{
  "$schema": "https://json-schema.org/draft/2020-12/schema",
  "$id": "urn:kip:2.0:schema:schema-package",
  "type": "object",
  "properties": {
    "format": {
      "const": "KIP-Schema-Package"
    },
    "format_version": {
      "const": "2.0-draft"
    },
    "manifest": {
      "type": "object",
      "properties": {
        "package_id": {
          "type": "string",
          "minLength": 1
        },
        "version": {
          "type": "string",
          "minLength": 1
        },
        "package_ref": {
          "type": "string",
          "minLength": 1
        },
        "validation_schemas": {
          "type": "array",
          "items": {
            "type": "object",
            "properties": {
              "id": {
                "type": "string",
                "minLength": 1
              },
              "content_digest": {
                "type": "string",
                "minLength": 1,
                "pattern": "^sha256:[0-9a-f]{64}$"
              }
            },
            "required": [
              "id",
              "content_digest"
            ],
            "additionalProperties": false
          }
        }
      },
      "required": [
        "package_id",
        "version",
        "package_ref"
      ],
      "additionalProperties": true
    },
    "dependencies": {
      "type": "array",
      "items": {
        "type": "object"
      }
    },
    "definitions": {
      "type": "object",
      "properties": {
        "concept_types": {
          "type": "object",
          "additionalProperties": {
            "type": "object",
            "properties": {
              "ref": {
                "type": "string",
                "minLength": 1
              },
              "kind": {
                "type": "string",
                "minLength": 1
              },
              "description": {
                "type": "string"
              },
              "fields": {
                "type": "object",
                "additionalProperties": {
                  "type": "object",
                  "properties": {
                    "type": {
                      "anyOf": [
                        {
                          "type": "string",
                          "minLength": 1
                        },
                        {
                          "type": "array",
                          "items": {
                            "type": "string",
                            "minLength": 1
                          }
                        }
                      ]
                    },
                    "required": {
                      "type": "boolean"
                    },
                    "mutable": {
                      "type": "boolean"
                    },
                    "value_schema": {
                      "type": "object"
                    }
                  },
                  "required": [
                    "type"
                  ],
                  "additionalProperties": true
                }
              },
              "attributes": {
                "type": "object",
                "properties": {
                  "open": {
                    "type": "boolean"
                  },
                  "fields": {
                    "type": "object",
                    "additionalProperties": {
                      "type": "object",
                      "properties": {
                        "type": {
                          "anyOf": [
                            {
                              "type": "string",
                              "minLength": 1
                            },
                            {
                              "type": "array",
                              "items": {
                                "type": "string",
                                "minLength": 1
                              }
                            }
                          ]
                        },
                        "required": {
                          "type": "boolean"
                        },
                        "mutable": {
                          "type": "boolean"
                        },
                        "value_schema": {
                          "type": "object"
                        }
                      },
                      "required": [
                        "type"
                      ],
                      "additionalProperties": true
                    }
                  },
                  "value_schema": {
                    "type": "object"
                  }
                },
                "required": [
                  "fields"
                ],
                "additionalProperties": false
              },
              "value_schema": {
                "type": "object"
              }
            },
            "required": [
              "ref",
              "kind"
            ],
            "additionalProperties": true
          }
        },
        "predicates": {
          "type": "object",
          "additionalProperties": {
            "type": "object",
            "properties": {
              "ref": {
                "type": "string",
                "minLength": 1
              },
              "kind": {
                "type": "string",
                "minLength": 1
              },
              "description": {
                "type": "string"
              },
              "fields": {
                "type": "object",
                "additionalProperties": {
                  "type": "object",
                  "properties": {
                    "type": {
                      "anyOf": [
                        {
                          "type": "string",
                          "minLength": 1
                        },
                        {
                          "type": "array",
                          "items": {
                            "type": "string",
                            "minLength": 1
                          }
                        }
                      ]
                    },
                    "required": {
                      "type": "boolean"
                    },
                    "mutable": {
                      "type": "boolean"
                    },
                    "value_schema": {
                      "type": "object"
                    }
                  },
                  "required": [
                    "type"
                  ],
                  "additionalProperties": true
                }
              },
              "attributes": {
                "type": "object",
                "properties": {
                  "open": {
                    "type": "boolean"
                  },
                  "fields": {
                    "type": "object",
                    "additionalProperties": {
                      "type": "object",
                      "properties": {
                        "type": {
                          "anyOf": [
                            {
                              "type": "string",
                              "minLength": 1
                            },
                            {
                              "type": "array",
                              "items": {
                                "type": "string",
                                "minLength": 1
                              }
                            }
                          ]
                        },
                        "required": {
                          "type": "boolean"
                        },
                        "mutable": {
                          "type": "boolean"
                        },
                        "value_schema": {
                          "type": "object"
                        }
                      },
                      "required": [
                        "type"
                      ],
                      "additionalProperties": true
                    }
                  },
                  "value_schema": {
                    "type": "object"
                  }
                },
                "required": [
                  "fields"
                ],
                "additionalProperties": false
              },
              "value_schema": {
                "type": "object"
              }
            },
            "required": [
              "ref",
              "kind"
            ],
            "additionalProperties": true
          }
        },
        "facets": {
          "type": "object",
          "additionalProperties": {
            "type": "object",
            "properties": {
              "ref": {
                "type": "string",
                "minLength": 1
              },
              "kind": {
                "type": "string",
                "minLength": 1
              },
              "description": {
                "type": "string"
              },
              "fields": {
                "type": "object",
                "additionalProperties": {
                  "type": "object",
                  "properties": {
                    "type": {
                      "anyOf": [
                        {
                          "type": "string",
                          "minLength": 1
                        },
                        {
                          "type": "array",
                          "items": {
                            "type": "string",
                            "minLength": 1
                          }
                        }
                      ]
                    },
                    "required": {
                      "type": "boolean"
                    },
                    "mutable": {
                      "type": "boolean"
                    },
                    "value_schema": {
                      "type": "object"
                    }
                  },
                  "required": [
                    "type"
                  ],
                  "additionalProperties": true
                }
              },
              "attributes": {
                "type": "object",
                "properties": {
                  "open": {
                    "type": "boolean"
                  },
                  "fields": {
                    "type": "object",
                    "additionalProperties": {
                      "type": "object",
                      "properties": {
                        "type": {
                          "anyOf": [
                            {
                              "type": "string",
                              "minLength": 1
                            },
                            {
                              "type": "array",
                              "items": {
                                "type": "string",
                                "minLength": 1
                              }
                            }
                          ]
                        },
                        "required": {
                          "type": "boolean"
                        },
                        "mutable": {
                          "type": "boolean"
                        },
                        "value_schema": {
                          "type": "object"
                        }
                      },
                      "required": [
                        "type"
                      ],
                      "additionalProperties": true
                    }
                  },
                  "value_schema": {
                    "type": "object"
                  }
                },
                "required": [
                  "fields"
                ],
                "additionalProperties": false
              },
              "value_schema": {
                "type": "object"
              }
            },
            "required": [
              "ref",
              "kind"
            ],
            "additionalProperties": true
          }
        },
        "structural_fields": {
          "type": "object",
          "additionalProperties": {
            "type": "object",
            "properties": {
              "ref": {
                "type": "string",
                "minLength": 1
              },
              "kind": {
                "type": "string",
                "minLength": 1
              },
              "description": {
                "type": "string"
              },
              "fields": {
                "type": "object",
                "additionalProperties": {
                  "type": "object",
                  "properties": {
                    "type": {
                      "anyOf": [
                        {
                          "type": "string",
                          "minLength": 1
                        },
                        {
                          "type": "array",
                          "items": {
                            "type": "string",
                            "minLength": 1
                          }
                        }
                      ]
                    },
                    "required": {
                      "type": "boolean"
                    },
                    "mutable": {
                      "type": "boolean"
                    },
                    "value_schema": {
                      "type": "object"
                    }
                  },
                  "required": [
                    "type"
                  ],
                  "additionalProperties": true
                }
              },
              "attributes": {
                "type": "object",
                "properties": {
                  "open": {
                    "type": "boolean"
                  },
                  "fields": {
                    "type": "object",
                    "additionalProperties": {
                      "type": "object",
                      "properties": {
                        "type": {
                          "anyOf": [
                            {
                              "type": "string",
                              "minLength": 1
                            },
                            {
                              "type": "array",
                              "items": {
                                "type": "string",
                                "minLength": 1
                              }
                            }
                          ]
                        },
                        "required": {
                          "type": "boolean"
                        },
                        "mutable": {
                          "type": "boolean"
                        },
                        "value_schema": {
                          "type": "object"
                        }
                      },
                      "required": [
                        "type"
                      ],
                      "additionalProperties": true
                    }
                  },
                  "value_schema": {
                    "type": "object"
                  }
                },
                "required": [
                  "fields"
                ],
                "additionalProperties": false
              },
              "value_schema": {
                "type": "object"
              }
            },
            "required": [
              "ref",
              "kind"
            ],
            "additionalProperties": true
          }
        }
      },
      "required": [],
      "additionalProperties": true
    },
    "constraints": {
      "type": "array",
      "items": {
        "type": "object"
      }
    },
    "aliases": {
      "type": "object"
    },
    "compatibility": {
      "type": "object"
    },
    "migrations": {
      "type": "array",
      "items": {}
    },
    "model_hints": {
      "type": "object"
    },
    "canonicalization": {
      "type": "object"
    },
    "integrity": {
      "type": "object",
      "properties": {
        "digest_profile": {
          "const": "kip-jcs-safe-v1"
        },
        "content_digest": {
          "type": "string",
          "minLength": 1,
          "pattern": "^sha256:[0-9a-f]{64}$"
        },
        "covers": {
          "type": "string",
          "minLength": 1
        },
        "signatures": {
          "type": "array",
          "items": {
            "type": "object"
          }
        }
      },
      "required": [
        "digest_profile",
        "content_digest"
      ],
      "additionalProperties": false
    }
  },
  "required": [
    "format",
    "format_version",
    "manifest",
    "definitions",
    "integrity"
  ],
  "additionalProperties": false
}
