{
  "format": "KIP-Schema-Package",
  "format_version": "2.0-draft",
  "manifest": {
    "package_id": "kip://test/secondary",
    "version": "1.0.0",
    "package_ref": "kip://test/secondary@1.0.0",
    "name": "KIP Conformance Secondary Domain",
    "description": "Secondary test package whose alias 'status' intentionally collides with the core-domain alias 'status'. Exact refs remain unambiguous.",
    "publisher": "urn:kip:test:publisher:conformance",
    "purpose": "conformance_fixture",
    "stability": "frozen_test_fixture",
    "executable": false
  },
  "dependencies": [
    {
      "package_id": "kip://test/core-domain",
      "version": "1.0.0",
      "package_ref": "kip://test/core-domain@1.0.0",
      "digest": "sha256:79a0c166847785cf3a0b56b0e33e625a9f3bb6e002232db86572f183fb250984",
      "required": true
    }
  ],
  "definitions": {
    "concept_types": {},
    "predicates": {
      "service_status": {
        "ref": "kip://test/secondary@1.0.0/service_status",
        "kind": "PredicateType",
        "description": "Semantic status of a Service, used only to create the local alias collision.",
        "subject": {
          "concept_types": [
            "kip://test/core-domain@1.0.0/Service"
          ]
        },
        "object": {
          "concept_types": [
            "kip://test/core-domain@1.0.0/StatusValue"
          ]
        },
        "functional": true,
        "open_world": true,
        "complete": false,
        "temporal_conflict": "overlapping_valid_time"
      }
    },
    "facets": {},
    "structural_fields": {},
    "enums": {},
    "registry_extensions": {}
  },
  "constraints": [],
  "aliases": {
    "concept_types": {},
    "predicates": {
      "status": "kip://test/secondary@1.0.0/service_status"
    },
    "facets": {},
    "structural_fields": {}
  },
  "compatibility": {
    "readable_with": [
      "kip://test/core-domain@1.0.0"
    ],
    "supersedes": [],
    "breaking_changes": []
  },
  "migrations": [],
  "model_hints": {
    "summary": "Activate with core-domain to test deterministic SchemaSymbolAmbiguous behavior.",
    "common_confusions": [
      "The alias 'status' is deliberately ambiguous when both packages are active.",
      "Use the exact ref project_status or service_status to disambiguate."
    ]
  },
  "canonicalization": {
    "profile": "kip-jcs-safe-v1",
    "status": "normative-draft",
    "description": "RFC 8785 JCS, narrowed to KIP portable safe integral values; no nonzero underflow; strict decoded-key/Unicode validation; integrity excluded from its own digest."
  },
  "integrity": {
    "digest_profile": "kip-jcs-safe-v1",
    "content_digest": "sha256:34eb9ac489ab1450bda46c9d7c22ff05fbd92a56695d41ef1026e2c58eeb39c8",
    "covers": "all top-level fields except integrity",
    "signatures": []
  }
}
